{
  "state_version": "run402.portable_release_state.v1",
  "site": {
    "paths": [
      {
        "path": "/index.html",
        "content_sha256": "d9f5613b7b61289760c1a69dcf586412bf665978fb49dee673dcaf9c1308e887",
        "size_bytes": 95,
        "content_type": "text/html"
      }
    ]
  },
  "static_manifest": {
    "version": "run402.static_manifest.v1",
    "public_path_mode": "explicit",
    "files": {
      "/index.html": {
        "sha256": "d9f5613b7b61289760c1a69dcf586412bf665978fb49dee673dcaf9c1308e887",
        "size": 95,
        "content_type": "text/html",
        "cache_class": "html",
        "cache_class_source": "declared"
      }
    }
  },
  "functions": [
    {
      "name": "api",
      "code_hash": "sha256:22962145d8c4024cf8f3b1f95565675f77824f13daa04c6740ed5fd17bc6298b",
      "runtime": "node22",
      "timeout_seconds": 10,
      "memory_mb": 128,
      "schedule": null,
      "deps": [],
      "require_auth": false,
      "require_role": null,
      "class": "standard",
      "capabilities": []
    },
    {
      "name": "ssr",
      "code_hash": "sha256:a729e40888aa6ec1ed065a852f8047ec57120b8fdb98870a0546de6920de0daf",
      "runtime": "node22",
      "timeout_seconds": 10,
      "memory_mb": 128,
      "schedule": null,
      "deps": [],
      "require_auth": false,
      "require_role": null,
      "class": "ssr",
      "capabilities": [
        "astro.ssr.v1"
      ]
    }
  ],
  "secrets": {
    "keys": [
      "OPENAI_API_KEY"
    ]
  },
  "subdomains": {
    "names": []
  },
  "routes": {
    "manifest_sha256": null,
    "entries": [
      {
        "pattern": "/api",
        "kind": "exact",
        "prefix": null,
        "methods": [
          "GET"
        ],
        "target": {
          "type": "function",
          "name": "api"
        }
      },
      {
        "pattern": "/*",
        "kind": "prefix",
        "prefix": "/",
        "methods": [
          "GET"
        ],
        "target": {
          "type": "function",
          "name": "ssr"
        }
      }
    ]
  },
  "migrations": [
    {
      "migration_id": "001_archive_fixture",
      "checksum_hex": "8bb7e9214568f6f4d7a0b2e1e122b6236c59b15a8d038d2ee04a35597d4fef77",
      "transaction": "default"
    }
  ],
  "i18n": null
}
